[
  {"id":"icj-cases","organization":"International Court of Justice","source_type":"official case and document index","priority":1,"discovery_url":"https://www.icj-cij.org/cases","enabled":true,"adapter":"manual","notes":"No stable machine-readable feed is assumed; inspect the official case index manually."},
  {"id":"icc-situations","organization":"International Criminal Court","source_type":"official situations and cases index","priority":1,"discovery_url":"https://www.icc-cpi.int/situations","enabled":true,"adapter":"manual","notes":"Manual discovery remains required; the registry does not imply an API or feed."},
  {"id":"un-documents","organization":"United Nations","source_type":"official document search","priority":1,"discovery_url":"https://documents.un.org/","enabled":true,"adapter":"manual","notes":"Use the official search interface; no unsupported crawling capability is claimed."},
  {"id":"ohchr-opt","organization":"Office of the United Nations High Commissioner for Human Rights","source_type":"official country page","priority":1,"discovery_url":"https://www.ohchr.org/en/countries/occupied-palestinian-territory","enabled":true,"adapter":"manual","notes":"Manual review of official publications is required."},
  {"id":"un-coi-opt-israel","organization":"Independent International Commission of Inquiry on the Occupied Palestinian Territory, including East Jerusalem, and Israel","source_type":"official commission page","priority":1,"discovery_url":"https://www.ohchr.org/en/hr-bodies/hrc/co-israel/index","enabled":true,"adapter":"manual","notes":"Manual discovery remains required where no reliable feed is exposed."},
  {"id":"un-special-procedures-opt","organization":"United Nations Special Procedures","source_type":"official mandate page","priority":2,"discovery_url":"https://www.ohchr.org/en/special-procedures/sr-palestine","enabled":true,"adapter":"manual","notes":"Official Special Rapporteur mandate page; manual discovery is required."}
]
